{
  "id": "mem_8a1f2c3d9b00",
  "kind": "memory_card",
  "label": "Response style",
  "content": "Answer in layers, avoid generic replies.",
  "sensitivity": "normal",
  "deep_allowed": false,
  "authority": false,
  "revocable": true,
  "created_at": "2026-06-18T10:01:00.000Z",
  "updated_at": "2026-06-18T10:01:00.000Z"
}
